1,1,200,¿Cuál es la capital de Sonora?,,Hermosillo
1,1,200,Periodo de tiempo en la historia de México en el cual estuvo dominada por el militar Oaxaqueño Porfirio Díaz.,,Porfiriato
1,1,200,¿En que año se independizó México?,,En 1821
1,1,200,Medallista olimpica del estado de Sinaloa en Tae-Kwon-Do,,María del Rosario Espinoza
1,1,200,"¿Quien escribio ""Don Quijote de la mancha""?",,Miguel de Cervantes
1,2,200,Plano que atraviesa longitudinalmente el cuerpo y lo divide en dos mitades.,Plano Medio Sagital;Plano Sagital;Plano Coronal ,Plano Medio Sagital
1,2,200,¿Cuáles son las diviciones funcionales del sistema esqueletico?,Tronco y miembros; Axial y Central; Axial y Apendicular,Axial y Apendicular
1,2,200,Menciona el nombre de un hueso trapezoidal de la caja torácica,Esternón; Manubrio;Xifoides,Manubrio
1,2,200,¿Cómo es la sangre que transportan las venas pulmonares?,Rojo brillante; Violeta; Rojo Obscuro,Rojo brillante
1,2,200,¿Cuál es la disposición del esofago en relación al arco de la aorta?,Posterior y a la izquierda; Anterior y a la derecha; Posterior y a la derecha,Posterior y a la derecha
1,3,200,¿Qué sustancia de la naturaleza es un excelente nucleófilo?,Agua; Hidroxido de amonio; Carbonos,Agua
1,3,200,¿Cuáll es la definición de pH?,Es el algoritmo negativo de la concentración de H; Es el logaritmo negativo de la concentración de H; Es disociación Negativa del Hidrogeno,Es el logaritmo negativo de la concentración de H
1,3,200,Es un sinónimo de Peroxidación,Autooxidación; Rancidez; Oxidación parcial,Autooxidación
1,3,200,Macromoléculas formadas por cadenas lineales de aminoácidos ,oligoelementos;proteinas;carbohidratos,proteinas
1,3,200,Los lípidos son solubles en solventes: ,No polares; Ésteres; Agua,No polares
1,4,200,Sustancia más utilizada en la fijación de tejidos:,,Formol
1,4,200,¿Cuál organelo tienen mejor desarrollado las celulas que conforman las glándulas endocrinas?,Aparato de Golgi; RER; Membrana Celular,RER
1,4,200,Molécula de adhesion transmembrana dependiente de Calcio.,Cadherinas;Integrinas;Selectinas,Cadherinas 
1,4,200,¿Cómo se le conoce al epitelio que conforma la Vejiga?,"epitelio plano estratificado, epitelio de transición, epitelio cubico",epitelio de transición 
1,4,200,¿Qué formas puede tener una célula epitelial?,cilindrica;cubica;plana; todas las anteriores ,todas las anteriores 
1,5,200,Es el proceso por el cual se establecen las tres capas germinativas y la formación axial del embrión.,Neurulacion; Blastocisto ; gastrulacion ,Blastocisto 
1,5,200,¿Cual es el primer sistema de organos que adquieren un estado funcional?,El SNC; El aparato digestivo; El Aparato Cardiovascular ,Aparato Cardiovascular 
1,5,200,"Los siguentes organos y sistemas se desarrollan apartir del ectodermo, excepto:",SNC; riñones; medula suprarrenal,Riñones 
1,5,200,"El latido cardiaco fetal se detecta por ecografia doppler, en la semana: ",5ta semana posfecundación/ 7ma semana UPM; 4ta Semana posfecundación/ 7ma semana UPM; 5ta semana posfecundación/ 6ta semana UPM,5ta semana posfecundacion/ 7ma semana UPM
1,5,200,¿Por qué es importante el desarrollo de las vellosidades corionicas? ,.,Para aumentar la superficie de intercambio entre circulación materna y fetal
1,1,400,¿Quién fue el campeón del último mundial de futbol soccer?,,Alemania
1,1,400,Libro con el que gano el premio Nobel de literatura el escritor Gabriel García Márquez,,100 años de soledad
1,1,400,"¿Quién pintó el retrato de ""La Mona Lisa""?",,Leonardo da Vinci
1,1,400,"En la mitología Griega, ¿quién fue la ninfa que se enamoró de Narciso y que murió en una cueva despues de que rechazo su amor?",,Eco
1,1,400,¿Cuál es el rio más grande el mundo?,,Amazonas
1,2,400,¿Cuál es la forma aproximada de la cavidad toráxica?,Tonel; Cono truncado; Trapezoide,cono truncado
1,2,400,¿Cuál es el nombre de las dos capas de tejido subcutáneo del abdomen?,Superficial adiposa y profunda membranosa; Profunda adiposa y superficial membranosa; superficial y profunda adiposa,superficial adiposa y profunda membranosa
1,2,400,Estructuras que forman el arco del pubis:,Pelvis mayor y menor; tuberosidades isquiaticas; ramas isquiopubianas,Ramas isquiopubianas
1,2,400,¿Cuáles son los componentes de una vértebra típica?,,"Cuerpo vertebral,  Arco vertebral Y siete apófisis"
1,2,400,¿Qué otro nombre reciben las acciones motoras finas?,"Maleastación, Ulnación, Manipulación",Manipulación
1,3,400,¿Cuál es el principal producto del cíclo del ácido cítrico?,Acetil CoA; Adenosin trifosfato; Glicerol,Adenosin trifosfato
1,3,400,"Compuesto de unión en las vias metabólicas: glucogénesis, gluconeogénesis, pentosa fosfato.","Glucosa 6-fosfato; Piruvato, Redox",Glucosa 6-fosfato
1,3,400,Es el precursor de hexoaminas,Azucares amino; Aminoacidos; Glucosa,Glucosa
1,3,400,Nombre de las sustancias que catalizan la hidrolisis del almidón,Amilasas; Aminooxidasas; Hidroxilasas,Amilasa
1,3,400,¿Cómo se le denomina a la sobrecarga de Hierro en la sangre?,Cromoferrosis; Hemocromatosis; Hemoferrosis,Hemocromatosis
1,4,400,Menciona los nombres específicos del epitelio según su localización ,Endotelio y Mesotelio;Mesotelio y transición; Endotelio y urotelio,Endotelio y Mesotelio 
1,4,400,¿Cómo se clasifican las células del tejido conjuntivo?,Fijas; En tránsito; Fijas y libres ,Fijas y libres 
1,4,400,Menciona los tipos de cartilagos ,.,"Cartilago Hialino, Cartilago fibroso y Cartilago Elástico "
1,4,400,Tipo de cartilago más abundante en el cuerpo ,,Cartilago Hialino 
1,4,400,"Presentan gránulos que se tiñen con colorantes básicos, libera agentes vasoactivos, en los frotis su núcleo lobulado suele quedar oculto tras los gránulos.",Neutrófilo;Eosinófilo;Basófilo ,Basófilo
1,5,400,Principal evento ocurrido en la segunda semana de gestación,Implantación; Embrioblasto da origen a un disco bilaminar; Neurulación  ,Embrioblasto da origen a un disco bilaminar 
1,5,400,Mantiene la actividad hormonal de cuerpo lúteo durante el embarazo y constituye un fundamento de las pruebas de embarazo por medio de anticuerpos para la subunidad beta ,hCG;Prolactina;progesterona ,hCG 
1,5,400,Al estar el trofoblasto en contacto con el endometrio este se diferencia en: ,Citotrofoblasto;Sincitiotrofoblasto;Citotrofoblasto y Sincitiotrofoblasto,Citotrofoblasto y sincitiotrofoblasto 
1,5,400,El epiblasto da origen a: ,ectodermo del amnios y endodermo del saco vitelino; ectodermo del saco vitelino  y linea primitiva; ectodermo embrionario y ectodermo del amnios,Ectodermo embrionario y ectodermo del amnios 
1,5,400,¿Qué son los nudos sincitiales?,Trozos de sincitio que entran en la circulación materna: trozos de citotrofoblasto que entran en la circulación materna; trozos de placenta que entran en la circulacion materna ,son trozos de sincitio que entran en la circulación materna 
1,1,600,Mencione le nombre de los niños heroes:,,"Juan Escutia, Fernando Montes de Oca, Juan de la Barrera, Francisco Márquez, Vicente Suarez, Agustin Melgar"
1,1,600,Ciudades donde se detonaron dos bombas nucleares en 1945:,,Hiroshima y Nagasaki
1,1,600,Año en que finalizó la segunda guerra mundial,,1945
1,1,600,Equipo de la MLB con más series mundiales ganadas:,,Yankees
1,1,600,"En la mitología Griega, ¿Qué personaje robo el fuego de los dioses para darlo a los hombres y que después fue castigado por Zeus?",,Prometeo
1,2,600,¿Cuáles son las ramas del tronco celíaco?,"Gástrica derecha, Esplénica, Hepática derecha; Gástrica izquierda, Esplénica, Hepática común; Gástrica derecha, Esplénica, Hepática común ","Gástrica izquierda, Esplénica, Hepatica común"
1,2,600,¿En que vena desemboca la safena menor?,,Vena popitlea derecha.
1,2,600,¿Cuál es la primer rama de la aorta ascendente?,,Las arterias Coronarias.
1,2,600,¿Que estructuras óseas conforman la pélvis?,,"Coxal derecho, Coxal izquierdo, Sacro."
1,2,600,¿Cuáles son las estructuras óseas que conforman al tarso?,,"Talus, Calcáneo, Cuboides, Navicular y 3 Cuneiformes."
1,3,600,Las personas AB+ pueden donar sangre a pacientes: ,AB+;A+-;O+,AB+
1,3,600,Principales componentes de la inmunidad específica ,Anticuerpos y Neutrofilos; Anticuerpos e Inmunoglobulinas; Anticuerpos y Linfocitos ,anticuerpos y linfocitos 
1,3,600,Prueba que se realiza en reacciones febriles para brucelosis,reacción de widal;reacción de Huddelson;reacción de hill,reacción de Huddelson
1,3,600,Descubridores del sistema Rh,,Stetson y Levine
1,3,600,Enfermedad infectocontagiosa causada por Salmonella Paratiphy,Salmonella;Brucelosis;Fiebre Tifoidea,Fiebre Tifoidea
1,4,600,Tipos de arterias ricas en fibras elásticas en la túnica media ,Arterias grandes; Arterias pequeñas;Arterias medianas,Arterias grandes 
1,4,600,Tipo de epitelio que reviste la tráquea ,Epitelio seudoestratificado plano ciliado;Epitelio seudoestratificado cilíndrico ciliado;Epitelio seudoestratificado cubico ciliado ,Epitelio seudoestratificado cilíndrico ciliado.
1,4,600,¿Cuáles son las 5 capas de la pared de los bronquios? ,.,"Mucosa, Muscular, Submucosa, Cartilaginosa, Adventicia"
1,4,600,"Tejido conectivo denso que rodea al cartílago hialino. Tiene dos capas: capa fibrosa con fibroblastos capa interna celular, contiene condroblastos.",Endostio;Periostio;Pericondrio,Pericondrio
1,4,600,"Célula basófila que muestra una red rica de Retículo Endoplasmatico Rugoso, un complejo  de  Golgi  bien  desarrollado, múltiples mitocondrias y abundancia de vesículas secretorias",Condrocito;Condroblasto;Osteoclasto,condroblasto
1,5,600,"Patologia que afecta al 5% de la embarazadas, inicia aproximadamente en la semana 20 de gestación ",eclampsia:preeclampsia;aborto espontáneo ,preeclampsia 
1,5,600,Proceso formativo por el cual se establecen las tres capas germinativas y la formación axial en el embrión ,,gastrulación 
1,5,600,Da lugar al mesodermo intraembrionario  ,"hipoblasto, epiblasto, mesoblasto ",mesoblasto
1,5,600,Da lugar al ligamento umbilical en los adultos ,alantoides; uraco; todas las anteriores ,alantoides 
1,5,600,Duración de la espermatogenesis,,2 meses 
1,1,800,"¿Qué significa ""Los Mochis""?",,Lugar de las tortugas terrestres
1,1,800,¿En qué año murió Valentin Elizalde?,,2006
1,1,800,¿Cómo se dividen los tres poderes en el modelo moderno republicano?,,"Ejecutivo, legislativo y judicial"
1,1,800,¿Cuáles son los nombres de los océanos?,,"Pacifico, atlantico, artico, indico,  antartico."
1,1,800,"Autor del libro ""La metamorfosis"":",,Franz Kafka
1,2,800,¿De donde se originan las raices del nervio sacro?,,De L4 a S4
1,2,800,¿Cuáles son las partes de un arco costal común?,,"Cabeza, Cuello, Tubérculo, Cuerpo "
1,2,800,¿Qué arteria irriga el cuerpo del páncreas?,,Arteria Esplénica
1,2,800,¿Qué musculos conforman el elevador del ano?,,"Puborectal, Pubococcigeo, Ileoccigeno."
1,2,800,¿Qué estructura se localiza en el forámen vertebral Cervical?,,Médula Espinal
1,3,800,Compuesto con capacidad de activar a la protein cinasa,Calmodulina; Diacilglicerol; Fosfolipasa,Diacilglicerol
1,3,800,¿En dónde se almacena la tiroglobulina de reserva?,Paratiroides;Foliculos tiroideos;Tirotrofo,Foliculos tiroideos
1,3,800,Se le denomina a una invaginacion en la membrana plasmatica,Hojuela; Palmitolio; Caveola,Caveola
1,3,800,Tipo de cola que tienen los ácidos grasos saturados,Cis; Rectas; Helicoidal,Rectas
1,3,800,Producto terminal del catabolismo del Nitrógeno,Urea; Amonio; Glutamina,Urea
1,4,800,"¿Cuál de los siguientes no, pertenece al grupo de los leucocitos agranulocitos?",neutrófilos;linfocitos;monocitos,neutrófilos
1,4,800,"Sus gránulos tienen afinidad por los colorantes ácidos, núcleo bilobulado, comprenden del 1-4% de los leucocitos. ",,Eosinófilos
1,4,800, Célula de la epidermis que interviene en la percepción sensorial cutánea,,Células de Merkel 
1,4,800,Fibras ricas en mioglobina y enzimas oxidativas. contienen abundantes mitocondrias y se tiñen de oscuro con la técnica de ATPasa a ph 4.2 y claras a ph 9.4,Fibras tipo I; Fibras tipo II; Fibras tipo III,Fibras tipo I
1,4,800,"Tipo de célula alargada (forma de cigarro), formada por un sincitio multinucleado su diametro varia de 10-100 μm",.,Célula muscular 
1,5,800,% de espermatozoides anómalos en cada eyaculación ,10%;12%;15%,0.1
1,5,800,Al conjunto de Ovocito primario más capas de células planas se le conoce como: ,Folículo secundario; Foliculo Primordial; Foliculo Primario ,Foliculo Primordial 
1,5,800,Estimula el desarollo de los foliculos ováricos y la producción de estrogenos por celulas foliculares ,,FSH
1,5,800,Dia en el cual el blastocito esta totalmente inmerso en el endometrio y el sitio de implantación ha sido completamente reepitelizado ,10 y 11; 11 y 12; 12 y 13,11 y 12
1,5,800,"¿Qué capa da lugar al SNC, encéfalo y médula espinal?",,Neuroectodermo 
1,1,1000,¿Cuál es el único mamifero capaz de volar?,,El murcielago
1,1,1000,¿Quién pintó la capilla sixtina?,,Miguel Angel
1,1,1000,"¿Quién pintó la obra ""el gran masturbador""?",,Salvador Dalí
1,1,1000,"Según la mitologia Griega, ¿Quiénes son los padres de los Titanes, Cyclopes, Hecatonquiros, y Echidna?",,Uranus Y Gaia
1,1,1000,¿Qué números usaba en el Jersey Michael Jordan?,,23 y 45
1,2,1000,¿Qué nombre recibe la capa delgada de sustancia blanca que esta por debajo del epéndimo y por encima de la superficie del hipocampo?,,Álveo
1,2,1000,¿A qué estructura se conecta en su parte anterior el fornix al cuerpo calloso?,,septum pellucidum
1,2,1000,¿Cuál es la rama más grande de la arteria vertebral ?,,Arteria cerebelosa posteroinferior
1,2,1000,Tipo de neuronas que esta compuesta en su mayoria la sustancia gelatinosa,,Neuronas de Golgi tipo II
1,2,1000,¿De qué se compone cada ganglio de la raiz posterior?,,Neuronas unipolares y celulas capsulares
1,3,1000,¿Cuál es el ejemplo común del núcleo estructural de los esteroides?,Fenantreno; Sulfatido; Gangliósido,Fenantreno
1,3,1000,¿Cuál es el unico tejido capaz de elevar la valencia del ion Yodo?,Pancreas; Tiroides; Musculo liso,Tiroides
1,3,1000,Elemtno que desvia el piruvato de la oxidación hacia la gluconeogénesis,,Acetil coenzima A
1,3,1000,"Se le denomina asi a la utilización de un N de un aminoácido para la síntesis de otro, en presencia de Piridoxina vit. B6 en su forma activa Fosfato de Piridoxal",,Transaminación 
1,3,1000,son los productos principales de la digestión de lípidos en el yeyuno.,,"Acidos grasos libres, colesterol libre y  el 2 monoacilglicerol"
1,4,1000,Neuronas motoras e interneuronas son ejemplos de neuronas ,,multipolares 
1,4,1000,Menciona al menos 2 neurotransmisores excitadores con apertura de los canales de ca+,,"Serotonina, glutamina, acetilcolina"
1,4,1000,Es una capa de células cuboideas o cilíndricas que reviste cavidades: los ventrículos cerebrales y el canal central de la médula espinal,.,células ependimarias
1,4,1000,La tinción de May Grünwal se utiliza principalmente para:,.,Coloreo de muestras de frotis sanguíneos o extendidos de médula óseo
1,4,1000,"Son las más importantes células presentadoras de antígenos, además de los macrófagos y los linfocitos en conjunto se les denomina  ""células presentadoras de antígenos profesionales"" ",,células dendríticas 
1,5,1000,Define feto papiráceo: ,,"feto momificado, comprimido por el desarrollo de su gemelo vivo"
1,5,1000,Se debe al defecto del cierre del neuroporo craneal asociado con anencefalia ,,Craneosquisis
1,5,1000,¿Comó se llama a la anomalía asociada con la ausencia del pectoral menor y y la perdida parcial del pectoral mayor ?,,Secuencia de Poland 
1,5,1000,Menciona los componentes de la tetralogia de Fallot:,,"Estenosis pulmonar infundibular, comunicación interventricular, cabalgamiento de la aorta, Hipertrofia del ventriculo derecho  "
1,5,1000,"Patologia asociada a bebés prematuros, la caracteristica principal es la insuficiencia del surfactante provocando el colapso alveolar ",,Enfermedad de las membranas hialinas o Sindrome de dificultad respiratoria (SDR)
2,1,200,¿Cúal es la capital de Alemania?,,Berlín
2,1,200,¿Cúal es la capital de Sinaloa?,,Culiacán
2,1,200,"¿Quién pintó ""la ultima cena""?",,Leonardo da Vinci
2,1,200,"¿Qué somos los humanos: omnívoros, herbívoros o carnívoros?",,Omnívoros
2,1,200,¿Cúal es el nombre del presidente de Los Estados Unidos de America?,,Donald Trump
2,2,200,Al mantenimiento de las condiciones casi constantes del medio interno se le llama:,Hemostasia; Ósmosis; Homeostasis,Homeostasis
2,2,200,La mayoría de los sistemas de control del organismo actúan mediante una retroalimentación ...,Negativa; Positiva; Endócrina ,Negativa
2,2,200,Unidad contráctil del músculo ,,Sarcómero 
2,2,200,¿Cuál es el potencial de membrana en reposo? (en fibra esquelética),-90mV; -50mv; -100mv,-90mv
2,2,200,Principal ión que participa en la contracción muscular,Potasio; Sodio; Calcio,Calcio
2,3,200,Es la información que obtenemos al interrogar el motivo el motivo de consulta ,Signos;Sintomas;Diagnóstico,Diagnóstico
2,3,200,¿En qué porcentaje nos acercamos al diagnóstico al elaborar una historia clínica completa?,80%;90%;70%,0.8
2,3,200,¿En qué áreas no debemos elaborar una historia clínica?,consulta externa y Hospitalización; Sala de espera y Hospitalización; Consulta interna y Hospitalización ,Sala de espera y hospitalización 
2,3,200,"Todas las siguientes son partes de una historia clínica, excepto: ","Antecendetes GyO y Antecedentes familiares, Antecedentes fiscales y Antecedentes penales;  situación economica y escolaridad ",Antecedentes fiscales y antecedentes penales
2,3,200,Menciona el orden general para realizar la exploración física:,,"Inspección, palpación, percusión y ascultación "
2,4,200,¿En qué afección está disminuida la absorcion de vitamina A y B12?,Tuberculosis; Giardiasis; Enf Chagas,Giardiasis
2,4,200,¿Cuál es el hospedero definitivo en la mayoria de los cestodos?,Cerdo; Humano; Bovinos ,Humano
2,4,200,¿Cuál es la forma infectante de Toxoplasma?,"Quistes; Bradizoito, Trofozoito",Quistes
2,4,200,Tambien se les conoce como centro oxidativo: ,Pared Celular;Retículo Endoplasmico Rugoso; mitocondrias,Mitocondrias
2,4,200,¿Cuál es el mayor componente de la pared celular de las Bacterias Gram positivas?,No tienen pared celular;Colesterol;peptidoglicano,Peptidoglicano
2,5,200,Todos los organismos vivos están formados por:,,células
2,5,200,¿Qué es el Genoma?,Información parcial contenida en una célula;Información;Información genética total contenida en una célula o en un organismo,Información genética total contenida en una célula o en un organismo.
2,5,200,¿Cuáles son las fases del ciclo célular?,"Fase G1, S, G2;Interface (G1, S, G2) y fase m (mitosis y citocinesis):Profase, metafase y anafase","Interface (G1, S, G2) y fase m (mitosis y citocinesis"
2,5,200,Proceso o procesos conocidos como expresión genética,Transcripción y traducción;Traducción;transcripción,transcripción y traducción
2,5,200,Fase del ciclo célular en la que se produce la replicación o síntesis del ADN,Fase M;Fase G2;Fase S,Fase S
2,1,400,¿Qué año llegó Cristobal Colón a América?,,1492
2,1,400,¿Cúal es el disco más vendido en la historia?,,Thriller de Michael Jackson
2,1,400,¿En qué se especializa la cartografía?,,En el estudio de los mapas
2,1,400,¿Dondé se encuenta la torre Eiffel?,,"En París, Francia."
2,1,400,¿Año en qué comenzó la segunda guerra mundial?,,1939
2,2,400,¿Cuál es el potencial de acción en una fibra muscular ventricular?,105mV;125mV;130mV,105mV
2,2,400,Intervalo de tiempo durante el cual un impulso cardiaco normal no puede reexcitar una zona ya excitada de músculo cardíaco,,Periodo Refractario 
2,2,400,¿Qué arteriola esta relativamente protegida de la contracción mediada por la angiotensina II?,Arteriola aferente; Arteriola eferente; Ninguna ,Arteriola Aferente 
2,2,400,Componentes del sistema yuxtaglomerular: ,,Células yuxtaglomerulares y Mácula densa
2,2,400,Músculos más importantes que elevan la caja torácia,Intercostales internos; Intercostales externos; rectos del abdomen ,Intercostales externos 
2,3,400,¿Dónde se localiza el foco de auscultación mitral?,,Segundo espacio intercostal y linea para-esternal izquierda 
2,3,400,¿Dónde se localiza el punto de Murphy?,Hipocondrio izquierdo a nivel de linea media clavicular; Hipocondrio derecho a nivel de linea media clavicular; Hipocondrio derecho a nivel de linea media axilar ,Hipocondrio derecho a nivel de linea media clavicular 
2,3,400,¿Qué signo se observa en hemorragia de tubo digestivo bajo?,Melena;Hematemesis;Hematoquecia ,Hematoquecia
2,3,400,¿Cómo se explora el signo de Giordano?,Puño-percusión a nivel de hipocondrio; Puño-percusión a nivel de fosa renal; puño-percusión a nivel suprapúbico ,puño-percusión a nivel de fosa renal 
2,3,400,La mano en garra se presenta en lesión del nervio:,radial y cubital; radial; cubital ,cubital
2,4,400,"Son sustancias naturales o sintéticas, que inhiben el crecimiento o la proliferación de bacterias",Antibiótico;Antimicotico; Antiviral,Antibiótico
2,4,400,¿Cuál de los siguentes generos de patogenos es el más frecuente en humanos?,Haemophilus; Hominis; Sp,Haemophilus
2,4,400,¿Cuál de los siguientes factores de virulencia participa en la respuesta inmunologica?,Metaloproteasa; Endoflagelos; Proteina TNP,Proteina TNP
2,4,400,Pais endémico de Paracoccidiomicosis,México; Suecia; Brasil ,Brasil
2,4,400,¿Cuál de las siguientes especies de clostridium no es enterotóxica?,C.perfringes; C.difficile; C.novyi,C.novyi
2,5,400,"Síntesis de glucosa a partir de moléculas orgánicas pequeñas como ácido láctico, acido pirúvico o aminoácidos",.,Gluconeogénesis
2,5,400,¿Qué es el Ácido Nucleico?,Cadena de nucleótidos unidos por enlaces fosfodiéster;Metabolito formado a partir de la degradación de ADN;Compuesto que tiene un ácido carboxilo unido a una larga cadena de hidratos de carbono.,Cadena de nucleótidos unidos por enlaces fosfodiéster
2,5,400,Relacionado con el ATP cual de la siguientes es correcta:,monofosfato de adenosina;difosfato de adenosina;trifosfato de adenosina.,trifosfato de adenosina
2,5,400,Define átomo:,Partícula más grande de un elemento que conserva sus propiedades químicas definitivas;Partícula más pequeña de un elemento que conserva sus propiedades químicas definitivas;Porción material mayor de un elemento químico que interviene en las reacciones químicas,Partícula más pequeña de un elemento que conserva sus propiedades químicas definitivas
2,5,400,El ADN se sintetiza en dirección:,,5´a 3´
2,1,600,¿Cuál es el país más poblado en la tierra?,,China
2,1,600,¿Cuál es el color que representa la esperanza?,,Verde
2,1,600,¿Comó se llama el animal más rápido del mundo?,,Guepardo
2,1,600,¿En qué país se encuentra el famoso monumento Taj Mahal?,,La India
2,1,600,¿Comó se llama el proceso por el cual las plantas obtienen alimentos?,,Fotosíntesis
2,2,600,Se le llama así al volumen de aire que queda en los pulmones al final de una espiración normal ,Capacidad espiratoria final; Capacidad Residual Funcional; Capacidad Residual espiratoria ,Capacidad Residual Funcional
2,2,600,Neurotransmisor Inhibitor: ,Acetilcolina; Ácido gama-aminobutírico; Glutamato ,Ácido gamma-aminobutírico
2,2,600, La ADH se sintetiza en ,Adenohipófisis; Neurohipófisis; Hipotálamo ,Hipotálamo 
2,2,600,¿Qué plexos forman el sistema nervioso entérico?,Plexo mientérico y plexo mucoso; plexo me Aberbach y plexo de Meissner; Plexo miénterico y plexo submucoso,Plexo mientérico y plexo submucoso
2,2,600,A los análogos de los macrófagos residentes del tejido hepático se les conoce como:,Células de Kupffer; Histiocitos; Célula espumosa,Células de Kupffer
2,3,600,Un paciente con hemianopsia bitemporal puede presentar un tumor en la siguiente localización: ,adenohipófisis; Neurohipófisis; Hipotálamo ,adenohipofisis
2,3,600," Son personas que mantienen una paraplejía con flexión plantar de los pies, estando estos separados a nivel del suelo, pero las piernas tienden a acercarse entre sí, contactando a nivel de las rodillas, así las dos piernas forman con el suelo un triángulo de vértice superior; las piernas están flexionadas ligeramente sobre los muslos y estos sobre el tronco, de modo que el paciente de pie parece que estuviera en actitud sentada o en cuclillas, ¿Qué tipo de marcha presentan?",marcha cerebelora; marcha en tijeras; marcha tabética,marcha en tijeras
2,3,600,signo característico de lesión del tracto piramidal o fascículo corticoespinal llamado síndrome de neurona motora superior,Signo de Koch; Signo de Babinski; todas las anteriores ,todas las anteriores 
2,3,600,"Ante una lesión dermatológica, se aplica el sistema de exploración: ",ABCDE;ABBCCD;ABBCDD,ABCDE
2,3,600,La parálisis de Bell es causada por daño al: ,V Par craneal; VI Par craneal; VII Par craneal ,VII Par craneal 
2,4,600,¿A qué farmaco es sensible la Balantadiasis?,Metronidazol; Nitrofurantoina;Vancomicina,Tetraciclinas
2,4,600,Mencione la capacidad Aerobia de Leptoespira,Facultativo; Obligado; Anaerobio,Obligado
2,4,600,"Cual de los siguientes patogenos cumple las caracteristicas de: Gram negativo, Catalasa positivo, oxidasa negativo y fermenta la glucosa.",Salmonella; E.coli; Candida,Salmonella
2,4,600,¿Cuál de los siguientes no forma parte de un lipopolisacárido?,Lipido A; Antigeno O; Proteina R,Proteina C
2,4,600,"¿Cómo se le denomina a una bacteria por la distribución de sus flagelos, siendo estos, multiples en un solo extremo?",Anfítricos; Perítricos; Lofótricos,Lofótricos
2,5,600,La mayor parte de los genes humanos están formados por:,Exones e intrones;Exones;Intrones ,exones e intrones
